{
  "analysis_id": "0d0f9f53-5284-4730-8521-19d43b37d4df",
  "status": "completed_with_limits",
  "mode": "understand",
  "evidence_links": [
    {
      "id": "e43401b8-4da9-44ad-aa46-49dc49117920",
      "analysis_id": "0d0f9f53-5284-4730-8521-19d43b37d4df",
      "status": "verified",
      "citing_claim": {
        "id": "24905f34-c8e1-434c-aa34-4a1df277ef2c",
        "text": "The method remains effective with limited labeled data.",
        "document_span": {
          "page": 4,
          "start_offset": 2110,
          "end_offset": 2172,
          "bounding_boxes": []
        },
        "qualifiers": [
          "remains effective",
          "limited labeled data"
        ]
      },
      "cited_work": {
        "work_id": "c36d6e18-1844-412f-bb10-6d0de40b3140",
        "work_version_id": "9d02c214-dc58-4358-b85b-51a214f719ef",
        "title": "Example Source Paper",
        "authors": [
          "A. Researcher",
          "B. Scientist"
        ],
        "year": 2025,
        "identifiers": {
          "doi": "10.0000/example"
        },
        "resolution_status": "resolved"
      },
      "citation_intents": [
        "result_support"
      ],
      "evidence_relation": "scope_mismatch",
      "scope_observations": [
        {
          "dimension": "dataset",
          "citing_scope": "general low-label settings",
          "source_scope": "two image-classification datasets",
          "supporting_source_span_ids": [
            "1f746f0a-bf64-48ae-b3fd-70607f775329"
          ]
        }
      ],
      "transformations": [],
      "source_spans": [
        {
          "id": "1f746f0a-bf64-48ae-b3fd-70607f775329",
          "asset_id": "36a6150b-a504-457e-b5fd-a648220e155d",
          "parsed_document_id": "9f62cd4f-218e-42b9-af5c-b88794b5175b",
          "access_level": "open_access_full_text",
          "page": 7,
          "section_path": [
            "4 Experiments",
            "4.2 Low-label setting"
          ],
          "quote": "With 10% of labels, the model improves accuracy on Dataset A and Dataset B.",
          "quote_sha256": "13774b1255fe5536e194d62018e637ceedd685a14966a1c01584ce8c07af829b",
          "start_offset": 8321,
          "end_offset": 8398,
          "evidence_type": "text_span",
          "bounding_boxes": []
        }
      ],
      "abstention": null,
      "explanation": {
        "summary": "The source supports a low-label result on two image datasets, but not a general claim across settings.",
        "statements": [
          {
            "text": "The experiment used 10% labeled data on two image-classification datasets.",
            "kind": "evidence_based",
            "supporting_span_ids": [
              "1f746f0a-bf64-48ae-b3fd-70607f775329"
            ],
            "confidence": 0.96
          },
          {
            "text": "Generalization beyond those datasets is not established by this source.",
            "kind": "inference",
            "supporting_span_ids": [
              "1f746f0a-bf64-48ae-b3fd-70607f775329"
            ],
            "confidence": 0.84
          }
        ]
      },
      "confidence": {
        "parse": 0.99,
        "reference_resolution": 0.96,
        "source_access": 1.0,
        "evidence_retrieval": 0.91,
        "relation_verification": 0.84,
        "explanation_grounding": 1.0,
        "weakest_link": 0.84,
        "balanced_score": 0.949,
        "calibration_profile": "relation-en-cs-v1",
        "reasons": [
          {
            "stage": "relation_verification",
            "code": "scope_language_ambiguous",
            "detail": "The citing claim is broader than the two evaluated datasets."
          }
        ]
      },
      "provenance": {
        "pipeline_version": "1.0.0",
        "taxonomy_version": "1.0.0",
        "prompt_pack_version": "2026-08-28.1",
        "parser_version": "grobid-0.9.1+normalizer-1.0.0",
        "source_policy_profile": "lawful-open-or-user-upload",
        "source_asset_ids": [
          "36a6150b-a504-457e-b5fd-a648220e155d"
        ],
        "source_asset_checksums": {
          "36a6150b-a504-457e-b5fd-a648220e155d": "1111111111111111111111111111111111111111111111111111111111111111"
        },
        "producer_records": [
          {
            "producer_type": "parser",
            "name": "grobid-normalizer",
            "version": "0.9.1+1.0.0",
            "operation": "parse_and_normalize",
            "input_fingerprint": "1111111111111111111111111111111111111111111111111111111111111111",
            "output_fingerprint": "2222222222222222222222222222222222222222222222222222222222222222",
            "occurred_at": "2026-08-28T10:01:00Z",
            "trace_id": "trace-example-001"
          },
          {
            "producer_type": "model",
            "name": "relation-verifier",
            "version": "route-profile-v1",
            "operation": "verify_relation",
            "input_fingerprint": "3333333333333333333333333333333333333333333333333333333333333333",
            "output_fingerprint": "4444444444444444444444444444444444444444444444444444444444444444",
            "occurred_at": "2026-08-28T10:03:00Z",
            "trace_id": "trace-example-001"
          }
        ],
        "access_decisions": [
          {
            "asset_id": "36a6150b-a504-457e-b5fd-a648220e155d",
            "access_level": "open_access_full_text",
            "acquisition_method": "open_repository",
            "policy_profile": "lawful-open-or-user-upload",
            "license_spdx": "CC-BY-4.0",
            "decided_at": "2026-08-28T10:00:30Z"
          }
        ]
      },
      "created_at": "2026-08-28T10:03:12Z"
    },
    {
      "id": "7bbf525f-f0be-487f-a0d2-40b261a3df34",
      "analysis_id": "0d0f9f53-5284-4730-8521-19d43b37d4df",
      "status": "blocked",
      "citing_claim": {
        "id": "6fba85a8-d55c-48ea-b284-56fa307f0180",
        "text": "Prior work establishes the same guarantee.",
        "document_span": {
          "page": 5,
          "start_offset": 3000,
          "end_offset": 3046,
          "bounding_boxes": []
        },
        "qualifiers": [
          "same guarantee"
        ]
      },
      "cited_work": {
        "work_id": "85f43d0c-484c-4ea9-b6c7-9b8cb057a865",
        "work_version_id": "046d6cc7-40db-4ab8-9a0c-e7e7eb1dfed9",
        "title": "Metadata-only Example",
        "authors": [
          "C. Author"
        ],
        "year": 2024,
        "identifiers": {
          "doi": "10.0000/metadata-only"
        },
        "resolution_status": "resolved"
      },
      "citation_intents": [
        "result_support"
      ],
      "evidence_relation": "inaccessible_source",
      "scope_observations": [],
      "transformations": [],
      "source_spans": [],
      "abstention": {
        "code": "inaccessible_source",
        "message": "The work was resolved, but no lawfully analyzable full text or abstract was available.",
        "recoverable_actions": [
          "upload_authorized_source"
        ]
      },
      "explanation": null,
      "confidence": {
        "parse": 0.98,
        "reference_resolution": 0.94,
        "source_access": 1.0,
        "evidence_retrieval": 0.0,
        "relation_verification": 0.0,
        "explanation_grounding": 0.0,
        "weakest_link": 0.0,
        "balanced_score": 0.37,
        "calibration_profile": "access-gate-v1",
        "reasons": [
          {
            "stage": "source_access",
            "code": "no_lawful_analyzable_content",
            "detail": "Only bibliographic metadata was available."
          }
        ]
      },
      "provenance": {
        "pipeline_version": "1.0.0",
        "taxonomy_version": "1.0.0",
        "prompt_pack_version": "2026-08-28.1",
        "parser_version": null,
        "source_policy_profile": "lawful-open-or-user-upload",
        "source_asset_ids": [
          "a0d56aa2-baf2-437c-b613-498e714197a0"
        ],
        "source_asset_checksums": {
          "a0d56aa2-baf2-437c-b613-498e714197a0": "5555555555555555555555555555555555555555555555555555555555555555"
        },
        "producer_records": [
          {
            "producer_type": "provider",
            "name": "metadata-resolver",
            "version": "1.0.0",
            "operation": "resolve_metadata",
            "input_fingerprint": "6666666666666666666666666666666666666666666666666666666666666666",
            "output_fingerprint": "7777777777777777777777777777777777777777777777777777777777777777",
            "occurred_at": "2026-08-28T10:02:00Z",
            "trace_id": "trace-example-002"
          }
        ],
        "access_decisions": [
          {
            "asset_id": "a0d56aa2-baf2-437c-b613-498e714197a0",
            "access_level": "not_accessible",
            "acquisition_method": "provider_metadata",
            "policy_profile": "lawful-open-or-user-upload",
            "license_spdx": null,
            "decided_at": "2026-08-28T10:02:15Z"
          }
        ]
      },
      "created_at": "2026-08-28T10:04:00Z"
    }
  ],
  "limitations": [
    {
      "code": "inaccessible_source",
      "message": "One cited work had metadata only.",
      "reference_entry_id": "c7e6a9c8-a2e6-4973-b8ef-56dd1371d500"
    }
  ],
  "created_at": "2026-08-28T10:00:00Z",
  "updated_at": "2026-08-28T10:04:30Z"
}
